[
  {
    "these": "Der Autoverkehr in der Innenstadt soll zugunsten von Rad- und Busverkehr eingeschränkt werden.",
    "partei": "Linke",
    "wertung": 1,
    "sicherheit": "hoch",
    "zitat": "Tempo 30 in der Innenstadt wird ausgeweitet. ... Schritte hin zum autofreien Bohlweg werden unternommen. ... Der ÖPNV wird weiter ausgebaut und attraktiver gemacht … Vorrang von Bussen an Ampeln, separate Busspuren.",
    "seite": 11,
    "kommentar": "Das Programm fordert, das Tempo in der Innenstadt auf 30 km/h zu erhöhen, autofreie Bereiche zu schaffen und den Radverkehr auszubauen. Gleichzeitig wird der ÖPNV gestärkt, Bus‑Vorrang an Ampeln und separate Busspuren vorgesehen. Diese Maßnahmen reduzieren den Autoverkehr zugunsten von Rad‑ und Busverkehr und unterstützen damit klar die Aussage, dass der Autoverkehr in der Innenstadt eingeschränkt werden soll.",
    "modell": "openwebui:GPT-OSS-120B",
    "eingelesen": "2026-08-19",
    "pruefung": {
      "zitat_verifiziert": true,
      "beleglage": "eindeutig",
      "retrieval_score": 0.6150062084197998,
      "judge_dissens": false,
      "volltext_gegenprobe": "n/a",
      "flags": [],
      "prioritaet": 0
    }
  },
  {
    "these": "Tempo 30 soll in Braunschweig der Standard sein, vor allem in der Innenstadt und in Wohngebieten.",
    "partei": "Linke",
    "wertung": 1,
    "sicherheit": "hoch",
    "zitat": "Tempo 30 in der Innenstadt wird ausgeweitet. Unsere Vision ist dieses Tempolimit überall innerhalb des wilhelminischen Rings.",
    "seite": 11,
    "kommentar": "Der Wahlprogrammeintrag erklärt ausdrücklich, dass das Tempolimit von 30 km/h in der Innenstadt ausgeweitet und sogar im gesamten wilhelminischen Ring gelten soll. Damit wird die Forderung, Tempo 30 zum Standard in Innenstadt und Wohngebieten zu machen, eindeutig unterstützt.",
    "modell": "openwebui:GPT-OSS-120B",
    "eingelesen": "2026-08-19",
    "pruefung": {
      "zitat_verifiziert": true,
      "beleglage": "eindeutig",
      "retrieval_score": 0.9669435024261475,
      "judge_dissens": false,
      "volltext_gegenprobe": "n/a",
      "flags": [],
      "prioritaet": 0
    }
  },
  {
    "these": "Neue Radwege sollen Vorrang vor dem Erhalt von Parkplätzen haben.",
    "partei": "Linke",
    "wertung": 0,
    "sicherheit": "niedrig",
    "zitat": "",
    "seite": null,
    "kommentar": "Die vorliegenden Passagen heben sowohl den Ausbau der Fahrradinfrastruktur als auch die Bedeutung von Parkplätzen für Anwohner*innen hervor, enthalten jedoch keine Aussage, dass neue Radwege Vorrang vor dem Erhalt von Parkplätzen haben oder umgekehrt. Damit lässt sich die These weder eindeutig unterstützen noch ablehnen.",
    "modell": "openwebui:GPT-OSS-120B",
    "eingelesen": "2026-08-19",
    "pruefung": {
      "zitat_verifiziert": false,
      "beleglage": "keine_fundstelle",
      "retrieval_score": null,
      "judge_dissens": false,
      "volltext_gegenprobe": "bestaetigt",
      "flags": [],
      "prioritaet": 0
    }
  },
  {
    "these": "Der Nahverkehr soll perspektivisch für alle kostenlos werden.",
    "partei": "Linke",
    "wertung": 1,
    "sicherheit": "hoch",
    "zitat": "Mittelfristig muss der ÖPNV für alle kostenfrei sein.",
    "seite": 12,
    "kommentar": "Der Text bezieht sich ausdrücklich darauf, dass der öffentliche Personennahverkehr mittelfristig kostenlos für alle angeboten werden soll. Damit wird die Aussage, dass der Nahverkehr perspektivisch für alle kostenlos werden soll, eindeutig unterstützt.",
    "modell": "openwebui:GPT-OSS-120B",
    "eingelesen": "2026-08-19",
    "pruefung": {
      "zitat_verifiziert": true,
      "beleglage": "eindeutig",
      "retrieval_score": 0.5286422371864319,
      "judge_dissens": false,
      "volltext_gegenprobe": "n/a",
      "flags": [],
      "prioritaet": 0
    }
  },
  {
    "these": "Braunschweig soll die Klimaneutralität mit höchster Priorität so schnell wie möglich erreichen.",
    "partei": "Linke",
    "wertung": 1,
    "sicherheit": "mittel",
    "zitat": "Wir lassen uns nicht entmutigen, sondern arbeiten weiter aktiv auf eine klimaneutrale Stadt hin.",
    "seite": 45,
    "kommentar": "Das Programm betont, dass die Stadt weiter aktiv auf Klimaneutralität hinarbeitet und das Klimaschutzkonzept kontinuierlich verfolgt. Damit wird die Erreichung von Klimaneutralität als vorrangiges Ziel dargestellt, was die Aussage unterstützt, dass Braunschweig Klimaneutralität mit höchster Priorität so schnell wie möglich erreichen soll.",
    "modell": "openwebui:GPT-OSS-120B",
    "eingelesen": "2026-08-19",
    "pruefung": {
      "zitat_verifiziert": true,
      "beleglage": "schwach",
      "retrieval_score": 0.900767982006073,
      "judge_dissens": false,
      "volltext_gegenprobe": "n/a",
      "flags": [],
      "prioritaet": 0
    }
  },
  {
    "these": "Klimaschutzmaßnahmen dürfen keine zusätzlichen Kosten oder Verbote für Bürger:innen und Unternehmen bedeuten.",
    "partei": "Linke",
    "wertung": -1,
    "sicherheit": "hoch",
    "zitat": "sozialen Folgen ... zum Beispiel Mietsteigerungen als Folge von Gebäudesanierungen ... wir werden unser Augenmerk darauf legen, dass die Stadt ihr Klimaschutzkonzept weiter verfolgt, dabei aber niemanden zurücklässt.",
    "seite": 45,
    "kommentar": "Der Quellenausschnitt (ID 155) nennt ausdrücklich, dass Klimaschutzmaßnahmen (Gebäudesanierungen) zu Mietsteigerungen führen können – also zu zusätzlichen Kosten für Bürger:innen. Damit widerspricht die Quelle der These, die keinerlei Kosten oder Verbote für Bürger:innen und Unternehmen zulässt. Die Aussage ist ein direkter impliziter Hinweis auf Kosten, sodass die These eindeutig opponiert wird.",
    "modell": "openwebui:GPT-OSS-120B",
    "eingelesen": "2026-08-19",
    "pruefung": {
      "zitat_verifiziert": true,
      "beleglage": "eindeutig",
      "retrieval_score": 0.017481336370110512,
      "judge_dissens": false,
      "volltext_gegenprobe": "n/a",
      "flags": [
        "human_review"
      ],
      "prioritaet": 1
    }
  },
  {
    "these": "Auf möglichst allen geeigneten städtischen Dächern und Parkplätzen sollen Solaranlagen entstehen.",
    "partei": "Linke",
    "wertung": 1,
    "sicherheit": "hoch",
    "zitat": "Beim Ausbau der erneuerbaren Energien haben bereits versiegelte Flächen oder Flächen zur Mehrfach‑Nutzung Vorrang – z.B. PV‑Parkplatzüberdachung, öffentliche Gebäude.",
    "seite": 18,
    "kommentar": "Der Text betont, dass bereits versiegelte oder für Mehrfach‑Nutzung geeignete Flächen, wie Parkplatzüberdachungen und öffentliche Gebäude, bei der Förderung erneuerbarer Energien Priorität haben. Damit wird ausdrücklich befürwortet, Solaranlagen auf städtischen Dächern und Parkplätzen zu installieren, was der geforderten Maßnahme entspricht.",
    "modell": "openwebui:GPT-OSS-120B",
    "eingelesen": "2026-08-19",
    "pruefung": {
      "zitat_verifiziert": true,
      "beleglage": "eindeutig",
      "retrieval_score": 0.21677365899085999,
      "judge_dissens": false,
      "volltext_gegenprobe": "n/a",
      "flags": [],
      "prioritaet": 0
    }
  },
  {
    "these": "Der Ausbau von Windkraft in Stadt und Region soll beschleunigt werden.",
    "partei": "Linke",
    "wertung": 0,
    "sicherheit": "niedrig",
    "zitat": "",
    "seite": null,
    "kommentar": "Die vorliegenden Ausschnitte erwähnen zwar bestehende Windkraftanlagen, Modernisierungen und einen langsamen, aber stetigen Ausbau erneuerbarer Energien, geben jedoch keinen Hinweis darauf, dass die Stadt den Ausbau von Windkraft aktiv beschleunigen will. Es gibt weder eine klare Zustimmung noch eine ausdrückliche Ablehnung des Vorhabens, sodass die Aussage nicht belegt werden kann.",
    "modell": "openwebui:GPT-OSS-120B",
    "eingelesen": "2026-08-19",
    "pruefung": {
      "zitat_verifiziert": false,
      "beleglage": "keine_fundstelle",
      "retrieval_score": 0.003730945521965623,
      "judge_dissens": false,
      "volltext_gegenprobe": "bestaetigt",
      "flags": [],
      "prioritaet": 0
    }
  },
  {
    "these": "Der Pflichtanteil (aktuell 30 %) für Sozialwohnungen bei Neubauprojekten soll erhöht werden.",
    "partei": "Linke",
    "wertung": 1,
    "sicherheit": "hoch",
    "zitat": "Um den Bestand an sozialem Wohnraum zu erhöhen, wird die Quote für sozial gebundene Wohnungen bei Neubauprojekten auf mindestens 50 % erhöht.",
    "seite": 4,
    "kommentar": "Der Wahlprogramm‑Auszug nennt ausdrücklich, dass die Quote für sozial gebundene Wohnungen bei Neubauprojekten auf mindestens 50 % angehoben werden soll, was das Vorhaben, den derzeitigen Pflichtanteil von 30 % zu erhöhen, klar unterstützt.",
    "modell": "openwebui:GPT-OSS-120B",
    "eingelesen": "2026-08-19",
    "pruefung": {
      "zitat_verifiziert": true,
      "beleglage": "eindeutig",
      "retrieval_score": 0.8670644164085388,
      "judge_dissens": false,
      "volltext_gegenprobe": "n/a",
      "flags": [],
      "prioritaet": 0
    }
  },
  {
    "these": "Die Stadt soll Bauland aktiv ankaufen, statt es an den Höchstbietenden zu verkaufen.",
    "partei": "Linke",
    "wertung": 1,
    "sicherheit": "hoch",
    "zitat": "Mit einer aktiven Bauland- und Bodenpolitik wird die Schaffung von günstigem Wohnraum unterstützt. Dafür wird die GGB finanziell besser ausgestattet und das Vorkaufsrecht zum Erwerb von vorrätigen Flächen genutzt.",
    "seite": 4,
    "kommentar": "Das Programm fordert eine aktive Bauland‑ und Bodenpolitik, nutzt das Vorkaufsrecht, um Flächen zu erwerben, und legt die Vergabe über kommunales Erbbaurecht fest. Damit wird deutlich, dass die Stadt Bauland aktiv ankaufen soll, anstatt es an den Höchstbietenden zu verkaufen.",
    "modell": "openwebui:GPT-OSS-120B",
    "eingelesen": "2026-08-19",
    "pruefung": {
      "zitat_verifiziert": true,
      "beleglage": "eindeutig",
      "retrieval_score": 0.07493765652179718,
      "judge_dissens": false,
      "volltext_gegenprobe": "n/a",
      "flags": [],
      "prioritaet": 0